[
  {
    "id": "asa-futurehouse-edison-agents",
    "removed": "2026-07-13",
    "reason": "Redundant umbrella over retained specific systems",
    "replacement_id": null
  },
  {
    "id": "asa-kosmos-radiation-biology-evaluation",
    "removed": "2026-07-13",
    "reason": "Case-study audit, not a reusable agent or benchmark",
    "replacement_id": null
  },
  {
    "id": "asa-a-mobile-robotic-chemist",
    "removed": "2026-07-13",
    "reason": "Exact duplicate",
    "replacement_id": "asa-mobile-robotic-chemist-liverpool-cooper"
  },
  {
    "id": "asa-biomedtools",
    "removed": "2026-07-13",
    "reason": "Tool registry/infrastructure, not an autonomous research agent",
    "replacement_id": null
  },
  {
    "id": "asa-atlas",
    "removed": "2026-07-13",
    "reason": "Bayesian-optimization component, not an agent or benchmark",
    "replacement_id": null
  },
  {
    "id": "asa-gryffin",
    "removed": "2026-07-13",
    "reason": "Bayesian-optimization algorithm, not an agent or benchmark",
    "replacement_id": null
  },
  {
    "id": "asa-fars",
    "removed": "2026-08-13",
    "reason": "Availability: the record's only official source (analemma.ai and its subdomains) has refused connections since the last live capture on 2026-06-23 and no live official replacement was found; the archived snapshot http://web.archive.org/web/20260623231233/https://analemma.ai/ documents the system historically. Reversible if an official live source reappears.",
    "replacement_id": null
  },
  {
    "id": "asa-periodic-labs",
    "removed": "2026-09-11",
    "reason": "Reversible HOLD: current official source describes a development goal but does not demonstrate the physical autonomous loop required for the prior A5 label. No discontinuation is inferred; restore the reserved ID if first-party system evidence supports an autonomy classification.",
    "replacement_id": null
  }
]
